;title;artist;genres;duration;explicit_content
0;Un-Break My Heart;Toni Braxton;['R&B', 'Soul'];270.0;0.0
1;No Diggity;BLACKstreet (Featuring Dr. Dre);['Pop'];305.0;0.0
2;Nobody;Keith Sweat Featuring Athena Cage;['Dance', 'Rock'];264.0;0.0
3;Don't Let Go (Love);En Vogue;['R&B'];291.0;0.0
4;It's All Coming Back To Me Now;Celine Dion;['Pop'];456.0;0.0
5;Mouth;Merril Bainbridge;['Pop'];205.0;0.0
6;Pony;Ginuwine;['R&B'];324.0;0.0
7;"I Finally Found Someone (From ""The Mirror Has Two Faces"")";Barbra Streisand & Bryan Adams;['Pop'];221.0;0.0
8;I'm Still In Love With You;New Edition;['R&B'];279.0;0.0
9;Where Do You Go;No Mercy;['Pop'];272.0;0.0
10;I Love You Always Forever;Donna Lewis;['Pop'];239.0;0.0
11;If It Makes You Happy;Sheryl Crow;['Pop'];323.0;0.0
12;When You Love A Woman;Journey;['Pop', 'Rock'];250.0;0.0
13;Macarena (Bayside Boys Mix);Los Del Rio;[];;
14;This Is For The Lover In You;Babyface Featuring LL Cool J, Howard Hewett, Jody Watley & Jeffrey Daniels;['R&B'];239.0;0.0
15;"Last Night (From ""The Nutty Professor"")";Az Yet;[];;
16;What Kind Of Man Would I Be;Mint Condition;['R&B'];246.0;0.0
17;Falling;Montell Jordan;['R&B'];244.0;0.0
18;Twisted;Keith Sweat;['Dance', 'Rock'];260.0;0.0
19;Change The World;Eric Clapton;['Rock', 'Rock & Roll/Rockabilly'];234.0;0.0
20;"You Must Love Me (From ""Evita"")";Madonna;['Films/Jeux vidéo', 'Musiques de films'];170.0;0.0
21;"Tell Me (From ""Eddie"")";Dru Hill;[];;
22;You're Makin' Me High/Let It Flow;Toni Braxton;['Pop', 'R&B', 'Soul'];262.0;0.0
23;Key West Intermezzo (I Saw You First);John Mellencamp;['Rock'];294.0;0.0
24;This Is Your Night;Amber;['Dance', 'Pop'];238.0;0.0
25;Counting Blue Cars;Dishwalla;['Rock'];292.0;0.0
26;No Time;Lil' Kim Featuring Puff Daddy;[];;
27;Street Dreams;Nas;['Rap/Hip Hop'];279.0;1.0
28;Between You And Me;dc Talk;[];298.0;0.0
29;C'mon N' Ride It (The Train);Quad City DJ's;['Dance'];248.0;0.0
30;You Learn/You Oughta Know;Alanis Morissette;[];;
31;My Boo;Ghost Town DJ's;['Pop'];346.0;0.0
32;Never Leave Me Alone;Nate Dogg Featuring Snoop Doggy Dogg;[];;
33;Let's Make A Night To Remember;Bryan Adams;['Pop'];378.0;0.0
34;Steelo;LL Cool J;[];;
35;Loungin;Westside Connection;[];;
36;Bow Down;Tracy Chapman;[];;
37;Give Me One Reason;Aaliyah;[];;
38;If Your Girl Only Knew;Gin Blossoms;[];;
39;Follow You Down/Til I Hear It From You;Jewel;[];;
40;Who Will Save Your Soul;The Braids;[];;
41;"Bohemian Rhapsody (From ""High School High"")";OutKast;[];;
42;Come See Me;Do Or Die (Featuring Twista);[];;
43;ATLiens;R.E.M.;[];;
44;Po Pimp;Brandy, Tamia, Gladys Knight & Chaka Khan;[];;
45;Bittersweet Me;The Cranberries;[];;
46;"Missing You (From ""Set It Off"")";Jocelyn Enriquez;[];;
47;When You're Gone/Free To Decide;112 Featuring The Notorious B.I.G.;[];;
48;Do You Miss Me;Donell Jones;[];;
49;Only You;Da Brat;[];;
50;Knocks Me Off My Feet;K-Ci & JoJo;[];;
51;Sittin' On Top Of The World;Jewel;[];;
52;"How Could You (From ""Bulletproof"")";The Wonders;[];;
53;Foolish Games/You Were Meant For Me;Total;[];;
54;"That Thing You Do! (From ""That Thing You Do!"")";Rod Stewart;[];;
55;When Boy Meets Girl;MC Lyte;[];;
56;If We Fall In Love Tonight;Gina G;[];;
57;Cold Rock A Party;Phil Collins;[];;
58;Ooh Aah... Just A Little Bit;The Isley Brothers Featuring Angela Winbush;[];;
59;Dance Into The Light;Melissa Etheridge;[];;
60;Floatin' On Your Love;The Smashing Pumpkins;[];;
61;Nowhere To Go;Kenny G;[];;
62;Thirty-Three;Republica;[];183.0;0.0
63;The Moment;The Original;['Films/Jeux vidéo', 'Musiques de films'];250.0;0.0
64;Ready To Go;Robert Miles Featuring Maria Nayler;[];;
65;I Luv U Baby;Wild Orchid;[];;
66;One And One;Angelina;['Classique'];139.0;0.0
67;At Night I Pray;Alan Jackson;[];;
68;I Don't Need Your Love;Rockell;[];;
69;Little Bitty;Duncan Sheik;[];;
70;I Fell In Love;Metallica;[];;
71;Barely Breathing;Amanda Marshall;[];;
72;Hero Of The Day;Le Click;[];;
73;Birmingham;Elton John;[];;
74;Tonight Is The Night;Richie Rich;[];;
75;You Can Make History (Young Again);Crush;[];;
76;Let's Ride;Gloria Estefan;[];;
77;Jellyhead;New Edition;[];;
78;I'm Not Giving You Up;Enigma;[];;
79;Hit Me Off;Warren G Featuring Adina Howard;[];;
80;Beyond The Invisible;The Blackout Allstars;[];;
81;"What's Love Got To Do With It (From ""Supercop"")";Whitney Houston;[];;
82;I Like It;Susanna Hoffs;[];;
83;"Why Does It Hurt So Bad (From ""Waiting To Exhale"")";SWV;[];;
84;All I Want;Johnny Gill;[];;
85;Use Your Heart;Garbage;[];;
86;Let's Get The Mood Right;Maxwell;[];;
87;Stupid Girl;JAY-Z;[];;
88;Ascension (Don't Ever Wonder);Alfonzo Hunter;[];;
89;Can't Knock The Hustle;dog's eye view;[];;
90;Just The Way (Playas Play);Trace Adkins;[];;
91;Everything Falls Apart/Small Wonders;Lost Boyz;[];;
92;Every Light In The House;The Tony Rich Project;[];;
93;Music Makes Me High;T-Boz;[];;
94;Leavin';Luther Vandross;[];;
95;"Touch Myself (From ""Fled"")";Deana Carter;[];;
96;Your Secret Love;OutKast;[];;
97;Strawberry Wine;For Real;[];;
98;Elevators (Me & You);;[];;
99;Like I Do;;[];;
